,longBusinessSummary,maxAge,priceHint,previousClose,open,dayLow,dayHigh,regularMarketPreviousClose,regularMarketOpen,regularMarketDayLow,regularMarketDayHigh,trailingPE,volume,regularMarketVolume,averageVolume,averageVolume10days,averageDailyVolume10Day,bid,ask,bidSize,askSize,yield,totalAssets,fiftyTwoWeekLow,fiftyTwoWeekHigh,fiftyDayAverage,twoHundredDayAverage,trailingAnnualDividendRate,trailingAnnualDividendYield,navPrice,currency,category,ytdReturn,beta3Year,fundFamily,fundInceptionDate,legalType,threeYearAverageReturn,fiveYearAverageReturn,exchange,quoteType,symbol,underlyingSymbol,shortName,longName,firstTradeDateEpochUtc,timeZoneFullName,timeZoneShortName,uuid,messageBoardId,gmtOffSetMilliseconds,trailingPegRatio,address1,city,state,zip,country,phone,website,industry,industryDisp,sector,sectorDisp,fullTimeEmployees,companyOfficers,auditRisk,boardRisk,compensationRisk,shareHolderRightsRisk,overallRisk,governanceEpochDate,compensationAsOfEpochDate,dividendRate,dividendYield,exDividendDate,payoutRatio,fiveYearAvgDividendYield,beta,forwardPE,marketCap,priceToSalesTrailing12Months,enterpriseValue,profitMargins,floatShares,sharesOutstanding,sharesShort,sharesShortPriorMonth,sharesShortPreviousMonthDate,dateShortInterest,sharesPercentSharesOut,heldPercentInsiders,heldPercentInstitutions,shortRatio,shortPercentOfFloat,impliedSharesOutstanding,bookValue,priceToBook,lastFiscalYearEnd,nextFiscalYearEnd,mostRecentQuarter,earningsQuarterlyGrowth,netIncomeToCommon,trailingEps,forwardEps,pegRatio,lastSplitFactor,lastSplitDate,enterpriseToRevenue,enterpriseToEbitda,52WeekChange,SandP52WeekChange,lastDividendValue,lastDividendDate,currentPrice,targetHighPrice,targetLowPrice,targetMeanPrice,targetMedianPrice,recommendationMean,recommendationKey,numberOfAnalystOpinions,totalCash,totalCashPerShare,ebitda,totalDebt,quickRatio,currentRatio,totalRevenue,debtToEquity,revenuePerShare,returnOnAssets,returnOnEquity,grossProfits,freeCashflow,operatingCashflow,earningsGrowth,revenueGrowth,grossMargins,ebitdaMargins,operatingMargins,financialCurrency,Instrument
0,"The Trust seeks to achieve its investment objective by holding a portfolio of the common stocks that are included in the index (the “Portfolio”), with the weight of each stock in the Portfolio substantially corresponding to the weight of such stock in the index.",86400,2,442.71,444.01,443.4,444.4301,442.71,444.01,443.4,444.4301,22.359215,9313407,9313407,72783358,70814150,70814150,443.62,443.63,1300,800,0.0145000005,412799303680,348.11,459.44,447.5084,417.6764,5.662,0.0127894115,442.68463,USD,Large Blend,0.17059201,1.0,SPDR State Street Global Advisors,727660800,Exchange Traded Fund,0.1188007,0.1068398,PCX,ETF,SPY,SPY,SPDR S&P 500,SPDR S&P 500 ETF Trust,728317800,America/New_York,EDT,e97de790-7e95-3762-8917-c59fcab3735e,finmb_6160262,-14400000,,,,,,,,,,,,,,,,,,,,,,,,,,,,,,,,,,,,,,,,,,,,,,,,,,,,,,,,,,,,,,,,,,,,,,,,,,,,,,,,,,,,,,,,,,,SPY
1,"Apple Inc. designs, manufactures, and markets smartphones, personal computers, tablets, wearables, and accessories worldwide. The company offers iPhone, a line of smartphones; Mac, a line of personal computers; iPad, a line of multi-purpose tablets; and wearables, home, and accessories comprising AirPods, Apple TV, Apple Watch, Beats products, and HomePod. It also provides AppleCare support and cloud services; and operates various platforms, including the App Store that allow customers to discover and download applications and digital content, such as books, music, video, games, and podcasts. In addition, the company offers various services, such as Apple Arcade, a game subscription service; Apple Fitness+, a personalized fitness service; Apple Music, which offers users a curated listening experience with on-demand radio stations; Apple News+, a subscription news and magazine service; Apple TV+, which offers exclusive original content; Apple Card, a co-branded credit card; and Apple Pay, a cashless payment service, as well as licenses its intellectual property. The company serves consumers, and small and mid-sized businesses; and the education, enterprise, and government markets. It distributes third-party applications for its products through the App Store. The company also sells its products through its retail and online stores, and direct sales force; and third-party cellular network carriers, wholesalers, retailers, and resellers. Apple Inc. was incorporated in 1977 and is headquartered in Cupertino, California.",86400,2,179.07,179.26,177.26,179.68,179.07,179.26,177.26,179.68,29.803675,12387715,12387715,57576620,78251520,78251520,177.4,177.45,1000,1000,,,124.17,198.23,184.2748,165.07864,0.93,0.0051934994,,USD,,,,,,,,,NMS,EQUITY,AAPL,AAPL,Apple Inc.,Apple Inc.,345479400,America/New_York,EDT,8b10e4ae-9eeb-3684-921a-9ab27e4d87aa,finmb_24937,-14400000,2.2808,One Apple Park Way,Cupertino,CA,95014,United States,408 996 1010,https://www.apple.com,Consumer Electronics,Consumer Electronics,Technology,Technology,164000,"[{'maxAge': 1, 'name': 'Mr. Timothy D. Cook', 'age': 61, 'title': 'CEO & Director', 'yearBorn': 1961, 'fiscalYear': 2022, 'totalPay': 16425933, 'exercisedValue': 0, 'unexercisedValue': 0}, {'maxAge': 1, 'name': 'Mr. Luca  Maestri', 'age': 59, 'title': 'CFO & Sr. VP', 'yearBorn': 1963, 'fiscalYear': 2022, 'totalPay': 5019783, 'exercisedValue': 0, 'unexercisedValue': 0}, {'maxAge': 1, 'name': 'Mr. Jeffrey E. Williams', 'age': 58, 'title': 'Chief Operating Officer', 'yearBorn': 1964, 'fiscalYear': 2022, 'totalPay': 5018337, 'exercisedValue': 0, 'unexercisedValue': 0}, {'maxAge': 1, 'name': 'Ms. Katherine L. Adams', 'age': 58, 'title': 'Sr. VP, Gen. Counsel & Sec.', 'yearBorn': 1964, 'fiscalYear': 2022, 'totalPay': 5015208, 'exercisedValue': 0, 'unexercisedValue': 0}, {'maxAge': 1, 'name': ""Ms. Deirdre  O'Brien"", 'age': 55, 'title': 'Sr. VP of Retail', 'yearBorn': 1967, 'fiscalYear': 2022, 'totalPay': 5019783, 'exercisedValue': 0, 'unexercisedValue': 0}, {'maxAge': 1, 'name': 'Mr. Chris  Kondo', 'title': 'Sr. Director of Corp. Accounting', 'exercisedValue': 0, 'unexercisedValue': 0}, {'maxAge': 1, 'name': 'Mr. James  Wilson', 'title': 'Chief Technology Officer', 'exercisedValue': 0, 'unexercisedValue': 0}, {'maxAge': 1, 'name': 'Ms. Mary  Demby', 'title': 'Chief Information Officer', 'exercisedValue': 0, 'unexercisedValue': 0}, {'maxAge': 1, 'name': 'Ms. Nancy  Paxton', 'title': 'Sr. Director of Investor Relations & Treasury', 'exercisedValue': 0, 'unexercisedValue': 0}, {'maxAge': 1, 'name': 'Mr. Greg  Joswiak', 'title': 'Sr. VP of Worldwide Marketing', 'exercisedValue': 0, 'unexercisedValue': 0}]",4,1,5,1,1,1693526400,1672444800,0.96,0.0054,1691712000,0.156,0.86,1.274896,26.95446,2777101369344,7.233297,2829222150144,0.24681,15616878002,15634199552,102091714,105460144,1690761600,1693440000,0.0064999997,0.00071999995,0.61317,1.8,0.0064999997,15634199552,3.852,46.11368,1663977600,1695513600,1688169600,0.023,94760001536,5.96,6.59,3.99,4:1,1598832000,7.369,22.824,0.1649102,0.17256784,0.24,1691712000,177.6299,240.0,149.0,199.58,200.0,2.0,buy,37,62482001920,3.996,123957002240,109280002048,0.814,0.982,383932989440,181.305,24.22,0.20896,1.60093,170782000000,90680500224,113071996928,0.05,-0.014,0.43449003,0.32286,0.29231,USD,AAPL
2,"The Trust holds gold bars and from time to time, issues Baskets in exchange for deposits of gold and distributes gold in connection with redemptions of Baskets. The investment objective of the Trust is for the Shares to reflect the performance of the price of gold bullion, less the Trust’s expenses. The Sponsor believes that, for many investors, the Shares represent a cost-effective investment in gold.",86400,2,179.22,179.34,179.34,180.355,179.22,179.34,179.34,180.355,,2973372,2973372,5488761,4606440,4606440,180.21,180.22,1000,3200,0.0,55565185024,150.57,191.36,179.2948,178.347,0.0,0.0,179.50647,USD,,0.056472503,0.13,SPDR State Street Global Advisors,1100736000,Exchange Traded Fund,-0.0072947,0.0949337,PCX,ETF,GLD,GLD,SPDR Gold Trust,SPDR Gold Shares,1100788200,America/New_York,EDT,b8aa1c71-9a1e-30a9-98e6-c05878a4fef3,finmb_5600649,-14400000,,,,,,,,,,,,,,,,,,,,,,,,,,,,,,,,,,,,,,,,,,,,,,,,,,,,,,,,,,,,,,,,,,,,,,,,,,,,,,,,,,,,,,,,,,,GLD
3,,86400,4,1.068262,1.0681478,1.0675777,1.0729614,1.068262,1.0681478,1.0675777,1.0729614,,0,0,0,0,0,1.072386,1.0718113,0,0,,,0.9540164,1.1275737,1.0923654,1.0830064,,,,USD,,,,,,,,,CCY,CURRENCY,EURUSD=X,EURUSD=X,EUR/USD,EUR/USD,1070236800,Europe/London,BST,1c974a98-f49a-3294-a47a-52edc95109aa,finmb_EUR_X,3600000,,,,,,,,,,,,,,,,,,,,,,,,,,,,,,,,,,,,,,,,,,,,,,,,,,,,,,,,,,,,,,,,,,,,,,,,,,,,,,,,,,,,,,,,,,,EURUSD=X
4,The fund generally will invest at least 80% of its assets in the component securities of its underlying index and in investments that have economic characteristics that are substantially identical to the component securities of its underlying index. The index is designed to measure equity market performance in the global emerging markets. The underlying index includes large- and mid-capitalization companies and may change over time.,86400,2,38.85,38.96,38.935,39.105,38.85,38.96,38.935,39.105,10.998479,3791769,3791769,27196493,23182100,23182100,39.05,39.06,1100,39400,0.0228,21355970560,33.49,42.53,39.842,39.50565,0.76,0.01956242,38.99956,USD,Diversified Emerging Mkts,0.0331348,0.94,iShares,1049673600,Exchange Traded Fund,-0.0247092,0.0038378998,PCX,ETF,EEM,EEM,iShares MSCI Emerging Index Fun,iShares MSCI Emerging Markets ETF,1050327000,America/New_York,EDT,328e4185-22bb-3cfc-89f2-569ce5e32229,finmb_8797528,-14400000,,,,,,,,,,,,,,,,,,,,,,,,,,,,,,,,,,,,,,,,,,,,,,,,,,,,,,,,,,,,,,,,,,,,,,,,,,,,,,,,,,,,,,,,,,,EEM
